{
"version": "1.0",
"mc_version": "1.20.4",
"name": "farmhouse_cabin",
"size": {
"x": 11,
"y": 11,
"z": 9
},
"palette": {
"foundation": "cobblestone",
"floor": "spruce_planks",
"support": "spruce_wood",
"wall": "oak_planks",
"roof": "dark_oak_planks",
"window": "white_stained_glass",
"door": "iron_door",
"fence": "oak_fence",
"chimney": "bricks",
"lamp": "glowstone"
},
"ops": [
{
"op": "box",
"from": [0, 0, 0],
"to": [10, 0, 8],
"block": "foundation"
},
{
"op": "box",
"from": [1, 1, 2],
"to": [9, 1, 7],
"block": "floor"
},
{
"op": "box",
"from": [2, 1, 0],
"to": [8, 1, 1],
"block": "floor"
},
{
"op": "line",
"from": [1, 1, 2],
"to": [1, 4, 2],
"block": "support"
},
{
"op": "line",
"from": [9, 1, 2],
"to": [9, 4, 2],
"block": "support"
},
{
"op": "line",
"from": [1, 1, 7],
"to": [1, 4, 7],
"block": "support"
},
{
"op": "line",
"from": [9, 1, 7],
"to": [9, 4, 7],
"block": "support"
},
{
"op": "line",
"from": [2, 1, 0],
"to": [2, 4, 0],
"block": "support"
},
{
"op": "line",
"from": [8, 1, 0],
"to": [8, 4, 0],
"block": "support"
},
{
"op": "box",
"from": [1, 2, 2],
"to": [9, 4, 2],
"block": "wall"
},
{
"op": "box",
"from": [1, 2, 7],
"to": [9, 4, 7],
"block": "wall"
},
{
"op": "box",
"from": [1, 2, 3],
"to": [1, 4, 6],
"block": "wall"
},
{
"op": "box",
"from": [9, 2, 3],
"to": [9, 4, 6],
"block": "wall"
},
{
"op": "line",
"from": [2, 3, 2],
"to": [3, 3, 2],
"block": "window"
},
{
"op": "line",
"from": [7, 3, 2],
"to": [8, 3, 2],
"block": "window"
},
{
"op": "line",
"from": [4, 3, 7],
"to": [6, 3, 7],
"block": "window"
},
{
"op": "line",
"from": [1, 3, 4],
"to": [1, 3, 5],
"block": "window"
},
{
"op": "line",
"from": [9, 3, 4],
"to": [9, 3, 5],
"block": "window"
},
{
"op": "line",
"from": [5, 2, 2],
"to": [5, 3, 2],
"block": "door"
},
{
"op": "line",
"from": [2, 5, 2],
"to": [8, 5, 2],
"block": "wall"
},
{
"op": "line",
"from": [3, 6, 2],
"to": [7, 6, 2],
"block": "wall"
},
{
"op": "line",
"from": [4, 7, 2],
"to": [6, 7, 2],
"block": "wall"
},
{
"op": "set",
"at": [5, 8, 2],
"block": "window"
},
{
"op": "line",
"from": [2, 5, 7],
"to": [8, 5, 7],
"block": "wall"
},
{
"op": "line",
"from": [3, 6, 7],
"to": [7, 6, 7],
"block": "wall"
},
{
"op": "line",
"from": [4, 7, 7],
"to": [6, 7, 7],
"block": "wall"
},
{
"op": "set",
"at": [5, 8, 7],
"block": "wall"
},
{
"op": "line",
"from": [3, 2, 0],
"to": [4, 2, 0],
"block": "fence"
},
{
"op": "line",
"from": [6, 2, 0],
"to": [7, 2, 0],
"block": "fence"
},
{
"op": "set",
"at": [2, 2, 1],
"block": "fence"
},
{
"op": "set",
"at": [8, 2, 1],
"block": "fence"
},
{
"op": "set",
"at": [5, 4, 1],
"block": "lamp"
},
{
"op": "line",
"from": [0, 5, 0],
"to": [0, 5, 8],
"block": "roof"
},
{
"op": "line",
"from": [10, 5, 0],
"to": [10, 5, 8],
"block": "roof"
},
{
"op": "line",
"from": [1, 6, 0],
"to": [1, 6, 8],
"block": "roof"
},
{
"op": "line",
"from": [9, 6, 0],
"to": [9, 6, 8],
"block": "roof"
},
{
"op": "line",
"from": [2, 7, 0],
"to": [2, 7, 8],
"block": "roof"
},
{
"op": "line",
"from": [8, 7, 0],
"to": [8, 7, 8],
"block": "roof"
},
{
"op": "line",
"from": [3, 8, 0],
"to": [3, 8, 8],
"block": "roof"
},
{
"op": "line",
"from": [7, 8, 0],
"to": [7, 8, 8],
"block": "roof"
},
{
"op": "line",
"from": [4, 9, 0],
"to": [4, 9, 8],
"block": "roof"
},
{
"op": "line",
"from": [6, 9, 0],
"to": [6, 9, 8],
"block": "roof"
},
{
"op": "line",
"from": [5, 10, 0],
"to": [5, 10, 8],
"block": "roof"
},
{
"op": "line",
"from": [2, 5, 6],
"to": [2, 9, 6],
"block": "chimney"
}
]
}
