{
  "version": "1.0",
  "mc_version": "1.20.4",
  "name": "test_cottage",
  "size": { "x": 7, "y": 5, "z": 6 },
  "palette": {
    "wall": "minecraft:oak_planks",
    "floor": "minecraft:cobblestone",
    "roof": "minecraft:oak_stairs"
  },
  "ops": [
    { "op": "box", "from": [0,0,0], "to": [6,0,5], "block": "floor" },
    { "op": "box_hollow", "from": [0,1,0], "to": [6,4,5], "block": "wall" },
    { "op": "line", "from": [0,4,0], "to": [6,4,0], "block": "roof" }
  ]
}
