{
  "version": "1.0",
  "mc_version": "1.20.4",
  "name": "Laptop",
  "size": {
    "x": 9,
    "y": 8,
    "z": 9
  },
  "palette": {
    "casing": "iron_block",
    "screen": "light_blue_stained_glass",
    "keys": "stone_button",
    "trackpad": "stone_pressure_plate",
    "logo": "glowstone"
  },
  "ops": [
    {
      "op": "box",
      "from": [1, 1, 3],
      "to": [7, 1, 7],
      "block": "casing"
    },
    {
      "op": "box",
      "from": [1, 2, 2],
      "to": [7, 6, 2],
      "block": "casing"
    },
    {
      "op": "box",
      "from": [2, 3, 2],
      "to": [6, 5, 2],
      "block": "screen"
    },
    {
      "op": "set",
      "at": [4, 4, 1],
      "block": "logo"
    },
    {
      "op": "line",
      "from": [2, 2, 4],
      "to": [6, 2, 4],
      "block": "keys"
    },
    {
      "op": "line",
      "from": [2, 2, 5],
      "to": [6, 2, 5],
      "block": "keys"
    },
    {
      "op": "set",
      "at": [4, 2, 6],
      "block": "trackpad"
    }
  ]
}