{
"version": "1.0",
"mc_version": "1.20.4",
"name": "modern_destroyer",
"size": {
"x": 38,
"y": 13,
"z": 12
},
"palette": {
"hull": "stone",
"deck": "cobblestone",
"superstructure": "iron_block",
"window": "light_blue_stained_glass",
"radar": "white_stained_glass",
"mast": "oak_fence",
"sensor": "glowstone",
"accent": "stone",
"helipad": "white_stained_glass"
},
"ops": [
{
"op": "box",
"from": [6, 0, 2],
"to": [29, 2, 9],
"block": "hull"
},
{
"op": "box",
"from": [3, 0, 3],
"to": [5, 1, 8],
"block": "hull"
},
{
"op": "box",
"from": [1, 0, 4],
"to": [2, 1, 7],
"block": "hull"
},
{
"op": "box",
"from": [0, 0, 5],
"to": [0, 0, 6],
"block": "hull"
},
{
"op": "box",
"from": [30, 0, 3],
"to": [33, 1, 8],
"block": "hull"
},
{
"op": "box",
"from": [34, 0, 4],
"to": [36, 1, 7],
"block": "hull"
},
{
"op": "box",
"from": [37, 0, 5],
"to": [37, 0, 6],
"block": "hull"
},
{
"op": "box",
"from": [4, 2, 3],
"to": [6, 2, 8],
"block": "hull"
},
{
"op": "box",
"from": [30, 2, 4],
"to": [36, 2, 7],
"block": "hull"
},
{
"op": "box",
"from": [7, 3, 3],
"to": [29, 3, 8],
"block": "deck"
},
{
"op": "box",
"from": [5, 3, 4],
"to": [6, 3, 7],
"block": "deck"
},
{
"op": "box",
"from": [30, 3, 3],
"to": [37, 3, 8],
"block": "deck"
},
{
"op": "line",
"from": [6, 1, 2],
"to": [29, 1, 2],
"block": "superstructure"
},
{
"op": "line",
"from": [6, 1, 9],
"to": [29, 1, 9],
"block": "superstructure"
},
{
"op": "line",
"from": [7, 4, 3],
"to": [29, 4, 3],
"block": "accent"
},
{
"op": "line",
"from": [7, 4, 8],
"to": [29, 4, 8],
"block": "accent"
},
{
"op": "box",
"from": [10, 4, 3],
"to": [16, 7, 8],
"block": "superstructure"
},
{
"op": "line",
"from": [10, 6, 4],
"to": [10, 6, 7],
"block": "window"
},
{
"op": "box",
"from": [17, 4, 4],
"to": [20, 6, 7],
"block": "superstructure"
},
{
"op": "box",
"from": [21, 4, 4],
"to": [24, 8, 7],
"block": "superstructure"
},
{
"op": "box",
"from": [25, 4, 3],
"to": [30, 6, 8],
"block": "superstructure"
},
{
"op": "line",
"from": [30, 5, 4],
"to": [30, 5, 7],
"block": "window"
},
{
"op": "box",
"from": [18, 7, 5],
"to": [19, 10, 6],
"block": "superstructure"
},
{
"op": "line",
"from": [18, 11, 5],
"to": [18, 12, 5],
"block": "mast"
},
{
"op": "line",
"from": [19, 11, 6],
"to": [19, 12, 6],
"block": "mast"
},
{
"op": "line",
"from": [16, 10, 5],
"to": [21, 10, 5],
"block": "mast"
},
{
"op": "line",
"from": [16, 9, 6],
"to": [21, 9, 6],
"block": "mast"
},
{
"op": "box_hollow",
"from": [17, 11, 4],
"to": [20, 12, 7],
"block": "radar"
},
{
"op": "box",
"from": [6, 4, 4],
"to": [8, 5, 7],
"block": "superstructure"
},
{
"op": "line",
"from": [3, 5, 5],
"to": [5, 5, 5],
"block": "accent"
},
{
"op": "line",
"from": [3, 5, 6],
"to": [5, 5, 6],
"block": "accent"
},
{
"op": "box",
"from": [27, 7, 5],
"to": [28, 8, 6],
"block": "superstructure"
},
{
"op": "set",
"at": [12, 5, 3],
"block": "sensor"
},
{
"op": "set",
"at": [12, 5, 8],
"block": "sensor"
},
{
"op": "set",
"at": [29, 5, 3],
"block": "sensor"
},
{
"op": "set",
"at": [29, 5, 8],
"block": "sensor"
},
{
"op": "set",
"at": [9, 4, 5],
"block": "sensor"
},
{
"op": "set",
"at": [9, 4, 6],
"block": "sensor"
},
{
"op": "line",
"from": [32, 3, 4],
"to": [32, 3, 7],
"block": "helipad"
},
{
"op": "line",
"from": [36, 3, 4],
"to": [36, 3, 7],
"block": "helipad"
},
{
"op": "line",
"from": [32, 3, 5],
"to": [36, 3, 5],
"block": "helipad"
}
]
}
