{
  "version": "1.0",
  "mc_version": "1.20.4",
  "name": "cozy_farmhouse_cabin",
  "size": {
    "x": 9,
    "y": 9,
    "z": 9
  },
  "palette": {
    "stone": "cobblestone",
    "wall": "oak_planks",
    "floor": "spruce_planks",
    "pillar": "stripped_oak_wood",
    "roof": "oak_planks",
    "window": "glass",
    "door": "iron_door",
    "fence": "oak_fence",
    "light": "glowstone",
    "chimney": "bricks",
    "path": "mossy_cobblestone"
  },
  "ops": [
    {
      "op": "box",
      "from": [0, 0, 0],
      "to": [8, 0, 8],
      "block": "stone"
    },
    {
      "op": "box_hollow",
      "from": [1, 1, 1],
      "to": [7, 5, 5],
      "block": "wall"
    },
    {
      "op": "box",
      "from": [2, 1, 2],
      "to": [6, 1, 4],
      "block": "floor"
    },
    {
      "op": "box",
      "from": [0, 1, 6],
      "to": [8, 1, 8],
      "block": "path"
    },
    {
      "op": "set",
      "at": [0, 1, 5],
      "block": "pillar"
    },
    {
      "op": "set",
      "at": [0, 2, 5],
      "block": "pillar"
    },
    {
      "op": "set",
      "at": [8, 1, 5],
      "block": "pillar"
    },
    {
      "op": "set",
      "at": [8, 2, 5],
      "block": "pillar"
    },
    {
      "op": "box",
      "from": [0, 3, 5],
      "to": [8, 3, 5],
      "block": "fence"
    },
    {
      "op": "set",
      "at": [4, 2, 5],
      "block": "door"
    },
    {
      "op": "set",
      "at": [3, 3, 5],
      "block": "window"
    },
    {
      "op": "set",
      "at": [5, 3, 5],
      "block": "window"
    },
    {
      "op": "set",
      "at": [1, 3, 3],
      "block": "window"
    },
    {
      "op": "set",
      "at": [7, 3, 3],
      "block": "window"
    },
    {
      "op": "set",
      "at": [4, 3, 1],
      "block": "window"
    },
    {
      "op": "box",
      "from": [6, 2, 2],
      "to": [6, 5, 2],
      "block": "chimney"
    },
    {
      "op": "box",
      "from": [6, 6, 2],
      "to": [6, 7, 2],
      "block": "chimney"
    },
    {
      "op": "box",
      "from": [0, 6, 0],
      "to": [8, 6, 6],
      "block": "roof"
    },
    {
      "op": "box",
      "from": [1, 7, 1],
      "to": [7, 7, 5],
      "block": "roof"
    },
    {
      "op": "box",
      "from": [2, 8, 2],
      "to": [6, 8, 4],
      "block": "roof"
    },
    {
      "op": "set",
      "at": [4, 4, 3],
      "block": "light"
    }
  ]
}
