{
  "version": "1.0",
  "mc_version": "1.20.4",
  "name": "Rustic_Farmhouse_Cabin",
  "size": {
    "x": 9,
    "y": 5,
    "z": 8
  },
  "palette": {
    "foundation": "12",
    "floor_wall": "13",
    "roof": "14",
    "window": "94",
    "main_door": "232",
    "chimney": "165",
    "threshold": "231",
    "railing": "254",
    "interior_light": "262",
    "fireplace_base": "1"
  },
  "ops": [
    {
      "op": "box",
      "from": [0, 1, 0],
      "to": [8, 1, 6],
      "block": "foundation"
    },
    {
      "op": "box",
      "from": [0, 4, 0],
      "to": [8, 4, 6],
      "block": "floor_wall"
    },
    {
      "op": "box",
      "from": [0, 2, 6],
      "to": [8, 3, 6],
      "block": "floor_wall"
    },
    {
      "op": "box",
      "from": [0, 2, 0],
      "to": [0, 3, 6],
      "block": "floor_wall"
    },
    {
      "op": "box",
      "from": [8, 2, 0],
      "to": [8, 3, 6],
      "block": "floor_wall"
    },
    {
      "op": "box",
      "from": [0, 2, 0],
      "to": [2, 3, 0],
      "block": "floor_wall"
    },
    {
      "op": "box",
      "from": [4, 2, 0],
      "to": [8, 3, 0],
      "block": "floor_wall"
    },
    {
      "op": "set",
      "at": [3, 1, 0],
      "block": "main_door"
    },
    {
      "op": "set",
      "at": [3, 1, -1],
      "block": "threshold"
    },
    {
      "op": "set",
      "at": [4, 2, 6],
      "block": "window"
    },
    {
      "op": "set",
      "at": [0, 2, 3],
      "block": "window"
    },
    {
      "op": "set",
      "at": [8, 2, 3],
      "block": "window"
    },
    {
      "op": "box",
      "from": [6, 4, 5],
      "to": [7, 5, 6],
      "block": "chimney"
    },
    {
      "op": "box",
      "from": [0, 5, 0],
      "to": [8, 5, 6],
      "block": "roof"
    },
    {
      "op": "box",
      "from": [1, 1, -1],
      "to": [5, 1, -1],
      "block": "foundation"
    },
    {
      "op": "set",
      "at": [1, 1, -1],
      "block": "railing"
    },
    {
      "op": "set",
      "at": [5, 1, -1],
      "block": "railing"
    },
    {
      "op": "set",
      "at": [1, 1, -2],
      "block": "railing"
    },
    {
      "op": "set",
      "at": [5, 1, -2],
      "block": "railing"
    },
    {
      "op": "set",
      "at": [4, 4, 3],
      "block": "interior_light"
    },
    {
      "op": "box",
      "from": [1, 1, 4],
      "to": [2, 1, 5],
      "block": "fireplace_base"
    }
  ]
}
