{
  "version": "1.0",
  "mc_version": "1.20.4",
  "name": "test_tower",
  "size": {"x": 3, "y": 8, "z": 3},
  "palette": {
    "foundation": "minecraft:stone",
    "wall": "minecraft:bricks",
    "window": "minecraft:glass"
  },
  "ops": [
    {"op": "box", "from": [0,0,0], "to": [2,0,2], "block": "foundation"},
    {"op": "box_hollow", "from": [0,1,0], "to": [2,7,2], "block": "wall"},
    {"op": "set", "at": [1,3,0], "block": "window"},
    {"op": "set", "at": [1,3,2], "block": "window"}
  ]
}