{
  "version": "1.0",
  "mc_version": "1.20.4",
  "name": "Farmhouse Cabin",
  "size": {
    "x": 9,
    "y": 7,
    "z": 9
  },
  "palette": {
    "floor": "cobblestone",
    "wall": "oak_planks",
    "corner": "oak_wood",
    "roof": "spruce_planks",
    "window": "glass",
    "door": "iron_door",
    "button": "stone_button",
    "fence": "oak_fence",
    "light": "glowstone"
  },
  "ops": [
    {
      "op": "box",
      "from": [1, 0, 2],
      "to": [7, 0, 7],
      "block": "floor"
    },
    {
      "op": "box",
      "from": [1, 0, 1],
      "to": [7, 0, 1],
      "block": "floor"
    },
    {
      "op": "box_hollow",
      "from": [1, 1, 2],
      "to": [7, 3, 7],
      "block": "wall"
    },
    {
      "op": "line",
      "from": [1, 1, 2],
      "to": [1, 3, 2],
      "block": "corner"
    },
    {
      "op": "line",
      "from": [7, 1, 2],
      "to": [7, 3, 2],
      "block": "corner"
    },
    {
      "op": "line",
      "from": [1, 1, 7],
      "to": [1, 3, 7],
      "block": "corner"
    },
    {
      "op": "line",
      "from": [7, 1, 7],
      "to": [7, 3, 7],
      "block": "corner"
    },
    {
      "op": "box",
      "from": [0, 4, 0],
      "to": [8, 4, 8],
      "block": "roof"
    },
    {
      "op": "box",
      "from": [1, 5, 1],
      "to": [7, 5, 7],
      "block": "roof"
    },
    {
      "op": "box",
      "from": [2, 6, 2],
      "to": [6, 6, 6],
      "block": "roof"
    },
    {
      "op": "set",
      "at": [4, 1, 2],
      "block": "door"
    },
    {
      "op": "set",
      "at": [4, 2, 2],
      "block": "door"
    },
    {
      "op": "set",
      "at": [3, 2, 1],
      "block": "button"
    },
    {
      "op": "set",
      "at": [5, 2, 1],
      "block": "button"
    },
    {
      "op": "line",
      "from": [2, 2, 2],
      "to": [3, 2, 2],
      "block": "window"
    },
    {
      "op": "line",
      "from": [5, 2, 2],
      "to": [6, 2, 2],
      "block": "window"
    },
    {
      "op": "line",
      "from": [1, 2, 4],
      "to": [1, 2, 5],
      "block": "window"
    },
    {
      "op": "line",
      "from": [7, 2, 4],
      "to": [7, 2, 5],
      "block": "window"
    },
    {
      "op": "line",
      "from": [3, 2, 7],
      "to": [5, 2, 7],
      "block": "window"
    },
    {
      "op": "line",
      "from": [1, 1, 1],
      "to": [3, 1, 1],
      "block": "fence"
    },
    {
      "op": "line",
      "from": [5, 1, 1],
      "to": [7, 1, 1],
      "block": "fence"
    },
    {
      "op": "set",
      "at": [1, 2, 1],
      "block": "light"
    },
    {
      "op": "set",
      "at": [7, 2, 1],
      "block": "light"
    },
    {
      "op": "set",
      "at": [4, 3, 4],
      "block": "light"
    }
  ]
}