{
  "version": "1.0",
  "mc_version": "1.20.4",
  "name": "Cottage_Cabin",
  "size": {
    "x": 9,
    "y": 9,
    "z": 9
  },
  "palette": {
    "cobblestone": "cobblestone",
    "spruce_planks": "spruce_planks",
    "spruce_wood": "spruce_wood",
    "dark_oak_planks": "dark_oak_planks",
    "white_stained_glass": "white_stained_glass",
    "iron_door": "iron_door",
    "stone_button": "stone_button",
    "glowstone": "glowstone",
    "oak_fence": "oak_fence"
  },
  "ops": [
    {
      "op": "box_hollow",
      "from": [0, 0, 0],
      "to": [8, 0, 8],
      "block": "cobblestone"
    },
    {
      "op": "box",
      "from": [1, 1, 1],
      "to": [7, 1, 7],
      "block": "spruce_planks"
    },
    {
      "op": "box_hollow",
      "from": [0, 1, 0],
      "to": [8, 4, 8],
      "block": "spruce_planks"
    },
    {
      "op": "box_hollow",
      "from": [0, 4, 0],
      "to": [8, 4, 8],
      "block": "spruce_wood"
    },
    {
      "op": "box_hollow",
      "from": [0, 1, 0],
      "to": [8, 1, 8],
      "block": "spruce_wood"
    },
    {
      "op": "box",
      "from": [0, 2, 0],
      "to": [0, 3, 0],
      "block": "spruce_wood"
    },
    {
      "op": "box",
      "from": [8, 2, 0],
      "to": [8, 3, 0],
      "block": "spruce_wood"
    },
    {
      "op": "box",
      "from": [0, 2, 8],
      "to": [0, 3, 8],
      "block": "spruce_wood"
    },
    {
      "op": "box",
      "from": [8, 2, 8],
      "to": [8, 3, 8],
      "block": "spruce_wood"
    },
    {
      "op": "box",
      "from": [3, 2, 0],
      "to": [3, 3, 0],
      "block": "spruce_wood"
    },
    {
      "op": "box",
      "from": [5, 2, 0],
      "to": [5, 3, 0],
      "block": "spruce_wood"
    },
    {
      "op": "box",
      "from": [4, 2, 8],
      "to": [4, 3, 8],
      "block": "spruce_wood"
    },
    {
      "op": "box",
      "from": [0, 2, 4],
      "to": [0, 3, 4],
      "block": "spruce_wood"
    },
    {
      "op": "box",
      "from": [8, 2, 4],
      "to": [8, 3, 4],
      "block": "spruce_wood"
    },
    {
      "op": "box",
      "from": [1, 2, 0],
      "to": [2, 3, 0],
      "block": "white_stained_glass"
    },
    {
      "op": "box",
      "from": [6, 2, 0],
      "to": [7, 3, 0],
      "block": "white_stained_glass"
    },
    {
      "op": "box",
      "from": [1, 2, 8],
      "to": [2, 3, 8],
      "block": "white_stained_glass"
    },
    {
      "op": "box",
      "from": [6, 2, 8],
      "to": [7, 3, 8],
      "block": "white_stained_glass"
    },
    {
      "op": "box",
      "from": [0, 2, 2],
      "to": [0, 3, 3],
      "block": "white_stained_glass"
    },
    {
      "op": "box",
      "from": [0, 2, 5],
      "to": [0, 3, 6],
      "block": "white_stained_glass"
    },
    {
      "op": "box",
      "from": [8, 2, 2],
      "to": [8, 3, 3],
      "block": "white_stained_glass"
    },
    {
      "op": "box",
      "from": [8, 2, 5],
      "to": [8, 3, 6],
      "block": "white_stained_glass"
    },
    {
      "op": "set",
      "at": [4, 1, 0],
      "block": "iron_door"
    },
    {
      "op": "set",
      "at": [4, 2, 0],
      "block": "iron_door"
    },
    {
      "op": "set",
      "at": [5, 2, 0],
      "block": "stone_button"
    },
    {
      "op": "box",
      "from": [1, 5, 0],
      "to": [7, 5, 8],
      "block": "dark_oak_planks"
    },
    {
      "op": "box",
      "from": [2, 6, 0],
      "to": [6, 6, 8],
      "block": "dark_oak_planks"
    },
    {
      "op": "box",
      "from": [3, 7, 0],
      "to": [5, 7, 8],
      "block": "dark_oak_planks"
    },
    {
      "op": "box",
      "from": [4, 8, 0],
      "to": [4, 8, 8],
      "block": "dark_oak_planks"
    },
    {
      "op": "set",
      "at": [4, 4, 4],
      "block": "glowstone"
    },
    {
      "op": "set",
      "at": [2, 4, 2],
      "block": "glowstone"
    },
    {
      "op": "set",
      "at": [6, 4, 2],
      "block": "glowstone"
    },
    {
      "op": "set",
      "at": [2, 4, 6],
      "block": "glowstone"
    },
    {
      "op": "set",
      "at": [6, 4, 6],
      "block": "glowstone"
    },
    {
      "op": "set",
      "at": [1, 2, 1],
      "block": "oak_fence"
    },
    {
      "op": "set",
      "at": [1, 3, 1],
      "block": "oak_fence"
    },
    {
      "op": "set",
      "at": [7, 2, 1],
      "block": "oak_fence"
    },
    {
      "op": "set",
      "at": [7, 3, 1],
      "block": "oak_fence"
    }
  ]
}
